[
  {
    "name": "Aaron",
    "aliases": [],
    "type": "character",
    "is_published": true,
    "clues": [
      {
        "text": "I played a role in helping bring some of the Ten Plagues upon Egypt.",
        "citations": "Exodus 7:19,20; Exodus 8:5,6,16,17; Exodus 9:8",
        "difficulty": "easy"
      },
      {
        "text": "I made a golden calf for the Israelites.",
        "citations": "Exodus 32:1-4",
        "difficulty": "easy"
      },
      {
        "text": "I served as Israel's first high priest.",
        "citations": "Exodus 28:1; Leviticus 8:12; Numbers 20:25-28",
        "difficulty": "easy"
      },
      {
        "text": "I spoke to Pharaoh on behalf of Moses.",
        "citations": "Exodus 7:1,2",
        "difficulty": "easy"
      },
      {
        "text": "I was Moses' brother.",
        "citations": "Exodus 4:14",
        "difficulty": "easy"
      },
      {
        "text": "My sister was Miriam.",
        "citations": "Numbers 26:59",
        "difficulty": "easy"
      },
      {
        "text": "God made me Moses' spokesman because I could speak very well.",
        "citations": "Exodus 4:14-16",
        "difficulty": "easy"
      },
      {
        "text": "My rod swallowed the rods of Egypt's magic-practicing priests.",
        "citations": "Exodus 7:10-12",
        "difficulty": "easy"
      },
      {
        "text": "I entered the priesthood together with four sons.",
        "citations": "Exodus 28:1",
        "difficulty": "medium"
      },
      {
        "text": "My sons included Nadab, Abihu, Eleazar, and Ithamar.",
        "citations": "Exodus 6:23",
        "difficulty": "medium"
      },
      {
        "text": "I met Moses in the wilderness after Jehovah sent me to him.",
        "citations": "Exodus 4:27",
        "difficulty": "medium"
      },
      {
        "text": "I was eighty-three years old when I spoke to Pharaoh.",
        "citations": "Exodus 7:7",
        "difficulty": "medium"
      },
      {
        "text": "I was instructed to wear a breastpiece bearing the names of Israel's tribes.",
        "citations": "Exodus 28:15-21",
        "difficulty": "medium"
      },
      {
        "text": "God said I would serve as a prophet to Moses.",
        "citations": "Exodus 7:1",
        "difficulty": "medium"
      },
      {
        "text": "Fire came out from Jehovah and consumed the offering I made on behalf of the people.",
        "citations": "Leviticus 9:7,24",
        "difficulty": "hard"
      },
      {
        "text": "I built an altar before a calf and called for a festival to Jehovah.",
        "citations": "Exodus 32:4,5",
        "difficulty": "hard"
      },
      {
        "text": "I held up one of Moses' hands during a battle, while Hur held the other.",
        "citations": "Exodus 17:12",
        "difficulty": "hard"
      },
      {
        "text": "I pleaded with Moses after Miriam was struck with leprosy.",
        "citations": "Numbers 12:10-13",
        "difficulty": "hard"
      },
      {
        "text": "I tried to explain how a calf appeared, saying that it came out after gold was thrown into a fire.",
        "citations": "Exodus 32:22-24",
        "difficulty": "hard"
      },
      {
        "text": "I went up a mountain with Nadab, Abihu, and seventy elders of Israel.",
        "citations": "Exodus 24:1,9,10",
        "difficulty": "hard"
      },
      {
        "text": "I wore the Urim and the Thummim over my heart when going in before Jehovah.",
        "citations": "Exodus 28:30",
        "difficulty": "hard"
      },
      {
        "text": "Incense in my hand helped stop a plague among the Israelites.",
        "citations": "Numbers 16:46-48",
        "difficulty": "hard"
      },
      {
        "text": "My rod budded, blossomed, and produced ripe almonds.",
        "citations": "Numbers 17:8",
        "difficulty": "hard"
      },
      {
        "text": "Together with Miriam, I spoke against Moses because of his wife.",
        "citations": "Numbers 12:1,2",
        "difficulty": "hard"
      },
      {
        "text": "I wore the breastpiece of judgement.",
        "citations": "Exodus 28:4,15,29",
        "difficulty": "hard"
      },
      {
        "text": "I married Elisheba, Amminadab's daughter.",
        "citations": "Exodus 6:23",
        "difficulty": "nightmare"
      },
      {
        "text": "I died on Mount Hor.",
        "citations": "Numbers 20:27,28",
        "difficulty": "nightmare"
      },
      {
        "text": "I stood between the dead and the living while a plague was halted.",
        "citations": "Numbers 16:46,48",
        "difficulty": "nightmare"
      },
      {
        "text": "I was forbidden from entering the Promised Land because of an incident involving water from a crag.",
        "citations": "Numbers 20:10-12",
        "difficulty": "nightmare"
      },
      {
        "text": "I was older than Moses by three years.",
        "citations": "Exodus 7:7",
        "difficulty": "nightmare"
      },
      {
        "text": "After two of my sons died for offering unauthorized fire, I kept silent.",
        "citations": "Leviticus 10:1-3",
        "difficulty": "nightmare"
      },
      {
        "text": "Jehovah told me to bless Israel with the words, “May Jehovah bless you and safeguard you.”",
        "citations": "Numbers 6:22-24",
        "difficulty": "nightmare"
      },
      {
        "text": "Korah and his company gathered together against Moses and me.",
        "citations": "Numbers 16:1-3",
        "difficulty": "nightmare"
      },
      {
        "text": "My priestly garments were removed and given to my son before I died.",
        "citations": "Numbers 20:25-28",
        "difficulty": "nightmare"
      },
      {
        "text": "My rod was kept before the Testimony as a sign to the rebels.",
        "citations": "Numbers 17:10",
        "difficulty": "nightmare"
      },
      {
        "text": "The entire house of Israel mourned me for thirty days.",
        "citations": "Numbers 20:29",
        "difficulty": "nightmare"
      }
    ]
  },
  {
    "name": "Abiram",
    "aliases": [],
    "type": "character",
    "is_published": true,
    "clues": [
      {
        "text": "One of my brothers was named Dathan.",
        "citations": "Numbers 26:9",
        "difficulty": "easy"
      },
      {
        "text": "I came out and took my stand at the entrance of my tent with Dathan and our families.",
        "citations": "Numbers 16:27",
        "difficulty": "easy"
      },
      {
        "text": "I rose up against Moses with Korah.",
        "citations": "Numbers 16:1,2",
        "difficulty": "easy"
      },
      {
        "text": "I accused Moses of failing to give the Israelites an inheritance of field and vineyard.",
        "citations": "Numbers 16:14",
        "difficulty": "medium"
      },
      {
        "text": "I said Moses had brought the people up only to put them to death in the wilderness.",
        "citations": "Numbers 16:13",
        "difficulty": "medium"
      },
      {
        "text": "I was a Reubenite son of Eliab.",
        "citations": "Numbers 16:1; Deuteronomy 11:6",
        "difficulty": "medium"
      },
      {
        "text": "I was one of the chosen ones of the assembly who fought against Moses and Aaron.",
        "citations": "Numbers 26:9",
        "difficulty": "medium"
      },
      {
        "text": "When Moses sent for me, I said I was not going to come.",
        "citations": "Numbers 16:12",
        "difficulty": "medium"
      },
      {
        "text": "One of my brothers was named Nemuel.",
        "citations": "Numbers 26:9",
        "difficulty": "hard"
      },
      {
        "text": "I stood at my tent entrance with my wife, my sons, and my little children while the assembly of Israel moved away from us.",
        "citations": "Numbers 16:25-27",
        "difficulty": "hard"
      },
      {
        "text": "Moses said that if the ground opened and swallowed me alive, Israel would know I had treated Jehovah disrespectfully.",
        "citations": "Numbers 16:28-30",
        "difficulty": "hard"
      },
      {
        "text": "Moses told the assembly not to touch anything that belonged to me, my brother or our families.",
        "citations": "Numbers 16:26",
        "difficulty": "hard"
      },
      {
        "text": "My tents and household were swallowed before the eyes of all Israel.",
        "citations": "Deuteronomy 11:6",
        "difficulty": "hard"
      },
      {
        "text": "A psalmist said that the earth covered those assembled with me.",
        "citations": "Psalm 106:17",
        "difficulty": "nightmare"
      },
      {
        "text": "I went down alive into the Grave with all who belonged to me.",
        "citations": "Numbers 16:33",
        "difficulty": "nightmare"
      },
      {
        "text": "Moses mentioned what God did to me as a reminder, before Israel entered the promised land.",
        "citations": "Deuteronomy 11:6-8",
        "difficulty": "nightmare"
      },
      {
        "text": "My judgment proved that my opposition was against Jehovah, not only against Moses.",
        "citations": "Numbers 16:30; Numbers 26:9",
        "difficulty": "nightmare"
      },
      {
        "text": "The earth opened and swallowed me, and I became a warning example.",
        "citations": "Numbers 26:9,10",
        "difficulty": "nightmare"
      }
    ]
  },
  {
    "name": "Achan",
    "aliases": [],
    "type": "character",
    "is_published": true,
    "clues": [
      {
        "text": "I secretly kept some of the spoils from Jericho.",
        "citations": "Joshua 7:20,21",
        "difficulty": "easy"
      },
      {
        "text": "I took things that had been devoted to destruction.",
        "citations": "Joshua 7:1",
        "difficulty": "easy"
      },
      {
        "text": "My theft brought trouble on all Israel.",
        "citations": "Joshua 7:1-5",